T:  Bus=04 Lev=01 Prnt=01 Port=00 Cnt=01 Dev#= 11 Spd=480 MxCh= 3
D:  Ver= 2.00 Cls=09(hub  ) Sub=00 Prot=01 MxPS=64 #Cfgs=  1
P:  Vendor=05ac ProdID=1006 Rev=96.15
S:  Manufacturer=Apple, Inc.
S:  Product=Keyboard Hub
S:  SerialNumber=000000000000
C:  #Ifs= 1 Cfg#= 1 Atr=a0 MxPwr=300mA
I:  If#=0x0 Alt= 0 #EPs= 1 Cls=09(hub  ) Sub=00 Prot=00 Driver=hub
T:  Bus=04 Lev=01 Prnt=01 Port=00 Cnt=01 Dev#= 11 Spd=480 MxCh= 3
D:  Ver= 2.00 Cls=09(hub  ) Sub=00 Prot=01 MxPS=64 #Cfgs=  1
P:  Vendor=05ac ProdID=1006 Rev=96.15
S:  Manufacturer=Apple, Inc.
S:  Product=Keyboard Hub
S:  SerialNumber=000000000000
C:  #Ifs= 1 Cfg#= 1 Atr=a0 MxPwr=300mA
I:  If#=0x0 Alt= 0 #EPs= 1 Cls=09(hub  ) Sub=00 Prot=00 Driver=hub
--
T:  Bus=04 Lev=02 Prnt=11 Port=01 Cnt=01 Dev#= 12 Spd=1.5 MxCh= 0
D:  Ver= 2.00 Cls=00(>ifc ) Sub=00 Prot=00 MxPS= 8 #Cfgs=  1
P:  Vendor=05ac ProdID=024f Rev=00.74
S:  Manufacturer=Apple Inc.
S:  Product=Apple Keyboard
C:  #Ifs= 2 Cfg#= 1 Atr=a0 MxPwr=20mA
I:  If#=0x0 Alt= 0 #EPs= 1 Cls=03(HID  ) Sub=01 Prot=01 Driver=usbhid
I:  If#=0x1 Alt= 0 #EPs= 1 Cls=03(HID  ) Sub=00 Prot=00 Driver=usbhid
T:  Bus=04 Lev=01 Prnt=01 Port=00 Cnt=01 Dev#= 11 Spd=480 MxCh= 3
D:  Ver= 2.00 Cls=09(hub  ) Sub=00 Prot=01 MxPS=64 #Cfgs=  1
P:  Vendor=05ac ProdID=1006 Rev=96.15
S:  Manufacturer=Apple, Inc.
S:  Product=Keyboard Hub
S:  SerialNumber=000000000000
C:  #Ifs= 1 Cfg#= 1 Atr=a0 MxPwr=300mA
I:  If#=0x0 Alt= 0 #EPs= 1 Cls=09(hub  ) Sub=00 Prot=00 Driver=hub
--
T:  Bus=04 Lev=02 Prnt=11 Port=01 Cnt=01 Dev#= 12 Spd=1.5 MxCh= 0
D:  Ver= 2.00 Cls=00(>ifc ) Sub=00 Prot=00 MxPS= 8 #Cfgs=  1
P:  Vendor=05ac ProdID=024f Rev=00.74
S:  Manufacturer=Apple Inc.
S:  Product=Apple Keyboard
C:  #Ifs= 2 Cfg#= 1 Atr=a0 MxPwr=20mA
I:  If#=0x0 Alt= 0 #EPs= 1 Cls=03(HID  ) Sub=01 Prot=01 Driver=usbhid
I:  If#=0x1 Alt= 0 #EPs= 1 Cls=03(HID  ) Sub=00 Prot=00 Driver=usbhid
T:  Bus=04 Lev=01 Prnt=01 Port=00 Cnt=01 Dev#= 11 Spd=480 MxCh= 3
D:  Ver= 2.00 Cls=09(hub  ) Sub=00 Prot=01 MxPS=64 #Cfgs=  1
P:  Vendor=05ac ProdID=1006 Rev=96.15
S:  Manufacturer=Apple, Inc.
S:  Product=Keyboard Hub
S:  SerialNumber=000000000000
C:  #Ifs= 1 Cfg#= 1 Atr=a0 MxPwr=300mA
I:  If#=0x0 Alt= 0 #EPs= 1 Cls=09(hub  ) Sub=00 Prot=00 Driver=hub
--
T:  Bus=04 Lev=02 Prnt=11 Port=01 Cnt=01 Dev#= 12 Spd=1.5 MxCh= 0
D:  Ver= 2.00 Cls=00(>ifc ) Sub=00 Prot=00 MxPS= 8 #Cfgs=  1
P:  Vendor=05ac ProdID=024f Rev=00.74
S:  Manufacturer=Apple Inc.
S:  Product=Apple Keyboard
C:  #Ifs= 2 Cfg#= 1 Atr=a0 MxPwr=20mA
I:  If#=0x0 Alt= 0 #EPs= 1 Cls=03(HID  ) Sub=01 Prot=01 Driver=usbhid
I:  If#=0x1 Alt= 0 #EPs= 1 Cls=03(HID  ) Sub=00 Prot=00 Driver=usbhid
T:  Bus=04 Lev=02 Prnt=11 Port=02 Cnt=02 Dev#= 13 Spd=12  MxCh= 0
D:  Ver= 2.00 Cls=00(>ifc ) Sub=00 Prot=00 MxPS= 8 #Cfgs=  1
P:  Vendor=046d ProdID=c52b Rev=12.01
S:  Manufacturer=Logitech
S:  Product=USB Receiver
C:  #Ifs= 3 Cfg#= 1 Atr=a0 MxPwr=98mA
I:  If#=0x0 Alt= 0 #EPs= 1 Cls=03(HID  ) Sub=01 Prot=01 Driver=usbhid
I:  If#=0x1 Alt= 0 #EPs= 1 Cls=03(HID  ) Sub=01 Prot=02 Driver=usbhid
SELinux status:                 disabled
root
daemon
bin
sys
sync
games
man
lp
mail
news
uucp
proxy
www-data
backup
list
irc
gnats
nobody
systemd-network
systemd-resolve
systemd-timesync
messagebus
syslog
_apt
_chrony
avahi-autoipd
sshd
systemd-coredump
brett
